{
  "model": "EleutherAI/pythia-1.4b",
  "n_layers": 24,
  "hidden_dim": 2048,
  "layer": 17,
  "provenance": {
    "model_revision": "fedc38a16eea3bd36a96b906d78d11d2ce18ed79",
    "script": "scripts/run_residualizer_split.py",
    "timestamp": "2026-05-05T02:10:58+00:00",
    "value_source": "runtime",
    "device": "cuda"
  },
  "protocol": {
    "ex_per_dim": 350,
    "batch_size": 48,
    "n_seeds": 7,
    "eval_seeds": [
      43,
      44,
      45,
      46,
      47,
      48,
      49
    ],
    "n_tokens_T": 716800,
    "n_tokens_R": 716800,
    "n_tokens_V": 189299,
    "n_docs_T": 12000,
    "n_docs_R": 12000,
    "n_docs_V": 1160
  },
  "residualizer_beta_main": [
    -5.356554083445988,
    0.003827151570484251,
    4.893492510709091
  ],
  "residualizer_beta_split": [
    -5.345168518207759,
    0.0038113223162187237,
    4.8924347921587525
  ],
  "main": {
    "mean": 0.1272255891170097,
    "std": 0.008286666278046195,
    "per_seed": [
      0.11908316774009202,
      0.1283927427219965,
      0.12650772560081203,
      0.14171323960404422,
      0.1338497851493815,
      0.11465524542212087,
      0.12637721758062065
    ],
    "pos_label_fraction": 0.3577301897321429
  },
  "split_fit": {
    "mean": 0.13932007396932608,
    "std": 0.008073933111293084,
    "per_seed": [
      0.13082003086394495,
      0.1396338790734785,
      0.14037314157823308,
      0.1545575268429944,
      0.14334465624431342,
      0.12773618959527852,
      0.13877509358703977
    ],
    "pos_label_fraction": 0.35435128348214284
  },
  "delta_rho": 0.012094484852316373
}